<?xml version="1.0" encoding="UTF-8"?>
<!DOCTYPE university [
<!ELEMENT university ( (department|course|instructor|teaches)+)>
<!ELEMENT department (dept_name, building, budget)>
<!ELEMENT course (course_id, title, dept_name, credits)>
<!ELEMENT instructor (IID, name, dept_name, salary)>
<!ELEMENT teaches (IID, course_id)>
<!ELEMENT dept_name (#PCDATA)>
<!ELEMENT building (#PCDATA)>
<!ELEMENT budget (#PCDATA)>
<!ELEMENT course_id (#PCDATA)>
<!ELEMENT title (#PCDATA)>
<!ELEMENT credits (#PCDATA)>
<!ELEMENT IID (#PCDATA)>
<!ELEMENT name (#PCDATA)>
<!ELEMENT salary (#PCDATA)>
]>
<university>
    <department>
        <dept_name>Computer Science</dept_name>
        <building>Building A</building>
        <budget>500000</budget>
    </department>
    <course>
        <course_id>CS-101</course_id>
        <title>Introduction to Computer Science</title>
        <dept_name>Computer Science</dept_name>
        <credits>4</credits>
    </course>
    <instructor>
        <IID>I12345</IID>
        <name>John Doe</name>
        <dept_name>Computer Science</dept_name>
        <salary>75000</salary>
    </instructor>
    <teaches>
        <IID>I12345</IID>
        <course_id>CS-101</course_id>
    </teaches>
    <department>
        <dept_name>Mathematics</dept_name>
        <building>Building B</building>
        <budget>300000</budget>
    </department>
    <course>
        <course_id>MA-101</course_id>
        <title>Introduction to Mathematics</title>
        <dept_name>Mathematics</dept_name>
        <credits>3</credits>
    </course>
    <instructor>
        <IID>I67890</IID>
        <name>Jane Smith</name>
        <dept_name>Mathematics</dept_name>
        <salary>65000</salary>
    </instructor>
    <teaches>
        <IID>I67890</IID>
        <course_id>MA-101</course_id>
    </teaches>
</university>
